"No.","Time","Source","Destination","Protocol","Length","Info"
"1","0.000000","192.168.2.4","224.0.0.251","IGMPv2","46","Membership Report group 224.0.0.251"
"2","0.367266","192.168.2.1","239.255.255.250","SSDP","311","NOTIFY * HTTP/1.1  "
"3","0.368458","192.168.2.1","239.255.255.250","SSDP","320","NOTIFY * HTTP/1.1  "
"4","0.368458","192.168.2.1","239.255.255.250","SSDP","383","NOTIFY * HTTP/1.1  "
"5","0.369291","192.168.2.1","239.255.255.250","SSDP","375","NOTIFY * HTTP/1.1  "
"6","0.369887","192.168.2.1","239.255.255.250","SSDP","320","NOTIFY * HTTP/1.1  "
"7","0.370625","192.168.2.1","239.255.255.250","SSDP","359","NOTIFY * HTTP/1.1  "
"8","0.370914","192.168.2.1","239.255.255.250","SSDP","391","NOTIFY * HTTP/1.1  "
"9","0.371520","192.168.2.1","239.255.255.250","SSDP","320","NOTIFY * HTTP/1.1  "
"10","0.372384","192.168.2.1","239.255.255.250","SSDP","379","NOTIFY * HTTP/1.1  "
"11","0.372910","192.168.2.1","239.255.255.250","SSDP","385","NOTIFY * HTTP/1.1  "
"12","0.373312","192.168.2.1","239.255.255.250","SSDP","373","NOTIFY * HTTP/1.1  "
"13","0.374255","192.168.2.1","239.255.255.250","SSDP","379","NOTIFY * HTTP/1.1  "
"14","0.374784","192.168.2.1","239.255.255.250","SSDP","309","NOTIFY * HTTP/1.1  "
"15","0.375361","192.168.2.1","239.255.255.250","SSDP","318","NOTIFY * HTTP/1.1  "
"16","0.375808","192.168.2.1","239.255.255.250","SSDP","373","NOTIFY * HTTP/1.1  "
"17","0.376572","192.168.2.1","239.255.255.250","SSDP","383","NOTIFY * HTTP/1.1  "
"18","2.727815","192.168.2.1","224.0.0.1","IGMPv2","46","Membership Query, general"
"19","2.999896","192.168.2.4","224.0.0.251","IGMPv2","46","Membership Report group 224.0.0.251"
"20","2.999980","192.168.2.4","224.0.0.252","IGMPv2","46","Membership Report group 224.0.0.252"
"21","3.000016","192.168.2.4","239.255.255.250","IGMPv2","46","Membership Report group 239.255.255.250"
"22","3.362522","192.168.2.1","239.255.255.250","SSDP","311","NOTIFY * HTTP/1.1  "
"23","3.363384","192.168.2.1","239.255.255.250","SSDP","320","NOTIFY * HTTP/1.1  "
"24","3.363959","192.168.2.1","239.255.255.250","SSDP","383","NOTIFY * HTTP/1.1  "
"25","3.364599","192.168.2.1","239.255.255.250","SSDP","375","NOTIFY * HTTP/1.1  "
"26","3.365172","192.168.2.1","239.255.255.250","SSDP","320","NOTIFY * HTTP/1.1  "
"27","3.365750","192.168.2.1","239.255.255.250","SSDP","359","NOTIFY * HTTP/1.1  "
"28","3.366387","192.168.2.1","239.255.255.250","SSDP","391","NOTIFY * HTTP/1.1  "
"29","3.367029","192.168.2.1","239.255.255.250","SSDP","320","NOTIFY * HTTP/1.1  "
"30","3.367667","192.168.2.1","239.255.255.250","SSDP","379","NOTIFY * HTTP/1.1  "
"31","3.368307","192.168.2.1","239.255.255.250","SSDP","385","NOTIFY * HTTP/1.1  "
"32","3.368849","192.168.2.1","239.255.255.250","SSDP","373","NOTIFY * HTTP/1.1  "
"33","3.369572","192.168.2.1","239.255.255.250","SSDP","379","NOTIFY * HTTP/1.1  "
"34","3.370156","192.168.2.1","239.255.255.250","SSDP","309","NOTIFY * HTTP/1.1  "
"35","3.370753","192.168.2.1","239.255.255.250","SSDP","318","NOTIFY * HTTP/1.1  "
"36","3.371442","192.168.2.1","239.255.255.250","SSDP","373","NOTIFY * HTTP/1.1  "
"37","3.372029","192.168.2.1","239.255.255.250","SSDP","383","NOTIFY * HTTP/1.1  "
"38","3.832305","192.168.2.4","8.8.8.8","DNS","84","Standard query 0x9e56 A win10.ipv6.microsoft.com"
"39","3.910981","8.8.8.8","192.168.2.4","DNS","182","Standard query response 0x9e56 A win10.ipv6.microsoft.com CNAME onpremwindows.ipv6.microsoft.com.akadns.net CNAME onprembn12.ipv6.microsoft.com.akadns.net A 157.56.106.189"
"40","8.293576","192.168.2.4","216.58.203.129","TCP","66","58384  >  443 [SYN] Seq=0 Win=64240 Len=0 MSS=1460 WS=256 SACK_PERM=1"
"41","8.293928","192.168.2.4","216.58.203.163","TCP","66","58385  >  443 [SYN] Seq=0 Win=64240 Len=0 MSS=1460 WS=256 SACK_PERM=1"
"42","8.294222","192.168.2.4","216.58.203.131","TCP","66","58386  >  443 [SYN] Seq=0 Win=64240 Len=0 MSS=1460 WS=256 SACK_PERM=1"
"43","8.304903","216.58.203.129","192.168.2.4","TCP","66","443  >  58384 [SYN, ACK] Seq=0 Ack=1 Win=42780 Len=0 MSS=1380 SACK_PERM=1 WS=256"
"44","8.305040","192.168.2.4","216.58.203.129","TCP","54","58384  >  443 [ACK] Seq=1 Ack=1 Win=66048 Len=0"
"45","8.305269","192.168.2.4","216.58.203.129","TLSv1.2","267","Client Hello"
"46","8.306856","216.58.203.163","192.168.2.4","TCP","66","443  >  58385 [SYN, ACK] Seq=0 Ack=1 Win=42780 Len=0 MSS=1380 SACK_PERM=1 WS=256"
"47","8.306997","192.168.2.4","216.58.203.163","TCP","54","58385  >  443 [ACK] Seq=1 Ack=1 Win=66048 Len=0"
"48","8.307167","192.168.2.4","216.58.203.163","TLSv1.2","571","Client Hello"
"49","8.307787","216.58.203.131","192.168.2.4","TCP","66","443  >  58386 [SYN, ACK] Seq=0 Ack=1 Win=42780 Len=0 MSS=1380 SACK_PERM=1 WS=256"
"50","8.307931","192.168.2.4","216.58.203.131","TCP","54","58386  >  443 [ACK] Seq=1 Ack=1 Win=66048 Len=0"
"51","8.308096","192.168.2.4","216.58.203.131","TLSv1.2","257","Client Hello"
"52","8.309316","192.168.2.4","216.58.203.132","TLSv1.2","128","Application Data"
"53","8.309415","192.168.2.4","216.58.203.132","TLSv1.2","100","Application Data"
"54","8.312705","216.58.203.129","192.168.2.4","TCP","54","443  >  58384 [ACK] Seq=1 Ack=214 Win=44032 Len=0"
"55","8.314660","216.58.203.129","192.168.2.4","TLSv1.2","1482","Server Hello"
"56","8.314661","216.58.203.129","192.168.2.4","TCP","1482","443  >  58384 [ACK] Seq=1429 Ack=214 Win=44032 Len=1428 [TCP segment of a reassembled PDU]"
"57","8.314662","216.58.203.132","192.168.2.4","TCP","60","443  >  58354 [ACK] Seq=1 Ack=75 Win=176 Len=0"
"58","8.314662","216.58.203.132","192.168.2.4","TCP","60","443  >  58354 [ACK] Seq=1 Ack=121 Win=176 Len=0"
"59","8.314737","192.168.2.4","216.58.203.129","TCP","54","58384  >  443 [ACK] Seq=214 Ack=2857 Win=66048 Len=0"
"60","8.315636","216.58.203.132","192.168.2.4","TLSv1.2","100","Application Data"
"61","8.315637","216.58.203.129","192.168.2.4","TLSv1.2","1482","Certificate [TCP segment of a reassembled PDU]"
"62","8.316597","216.58.203.129","192.168.2.4","TLSv1.2","79","Server Key Exchange, Server Hello Done"
"63","8.316643","192.168.2.4","216.58.203.129","TCP","54","58384  >  443 [ACK] Seq=214 Ack=4310 Win=66048 Len=0"
"64","8.318659","192.168.2.4","216.58.203.129","TLSv1.2","312","Client Key Exchange, Change Cipher Spec, Encrypted Handshake Message, Encrypted Handshake Message"
"65","8.319577","216.58.203.163","192.168.2.4","TCP","54","443  >  58385 [ACK] Seq=1 Ack=518 Win=44032 Len=0"
"66","8.319578","216.58.203.163","192.168.2.4","TLSv1.2","214","Server Hello, Change Cipher Spec, Encrypted Handshake Message"
"67","8.319578","216.58.203.131","192.168.2.4","TCP","54","443  >  58386 [ACK] Seq=1 Ack=204 Win=44032 Len=0"
"68","8.320528","216.58.203.131","192.168.2.4","TLSv1.2","1482","Server Hello"
"69","8.320529","216.58.203.131","192.168.2.4","TCP","1482","443  >  58386 [ACK] Seq=1429 Ack=204 Win=44032 Len=1428 [TCP segment of a reassembled PDU]"
"70","8.320588","192.168.2.4","216.58.203.131","TCP","54","58386  >  443 [ACK] Seq=204 Ack=2857 Win=66048 Len=0"
"71","8.321526","216.58.203.131","192.168.2.4","TLSv1.2","1482","Certificate [TCP segment of a reassembled PDU]"
"72","8.321696","192.168.2.4","216.58.203.163","TLSv1.2","270","Change Cipher Spec, Encrypted Handshake Message, Encrypted Handshake Message"
"73","8.322519","216.58.203.131","192.168.2.4","TLSv1.2","148","Server Key Exchange, Server Hello Done"
"74","8.322559","192.168.2.4","216.58.203.131","TCP","54","58386  >  443 [ACK] Seq=204 Ack=4379 Win=66048 Len=0"
"75","8.325649","192.168.2.4","216.58.203.131","TLSv1.2","312","Client Key Exchange, Change Cipher Spec, Encrypted Handshake Message, Encrypted Handshake Message"
"76","8.327382","216.58.203.129","192.168.2.4","TLSv1.2","375","New Session Ticket, Change Cipher Spec, Encrypted Handshake Message"
"77","8.328372","216.58.203.129","192.168.2.4","TLSv1.2","123","Application Data"
"78","8.328420","192.168.2.4","216.58.203.129","TCP","54","58384  >  443 [ACK] Seq=472 Ack=4700 Win=65792 Len=0"
"79","8.329395","216.58.203.163","192.168.2.4","TLSv1.2","123","Application Data"
"80","8.334271","216.58.203.131","192.168.2.4","TLSv1.2","375","New Session Ticket, Change Cipher Spec, Encrypted Handshake Message"
"81","8.334273","216.58.203.131","192.168.2.4","TLSv1.2","123","Application Data"
"82","8.334347","192.168.2.4","216.58.203.131","TCP","54","58386  >  443 [ACK] Seq=462 Ack=4769 Win=65792 Len=0"
"83","8.356653","192.168.2.4","216.58.203.132","TCP","54","58354  >  443 [ACK] Seq=121 Ack=47 Win=258 Len=0"
"84","8.368934","192.168.2.4","216.58.203.163","TCP","54","58385  >  443 [ACK] Seq=734 Ack=230 Win=65792 Len=0"
"85","8.392990","216.58.203.132","192.168.2.4","TLSv1.2","124","Application Data"
"86","8.394069","216.58.203.132","192.168.2.4","TLSv1.2","1482","Application Data"
"87","8.394070","216.58.203.132","192.168.2.4","TLSv1.2","427","Application Data"
"88","8.394070","216.58.203.132","192.168.2.4","TLSv1.2","92","Application Data"
"89","8.394070","216.58.203.132","192.168.2.4","TLSv1.2","100","Application Data"
"90","8.394120","192.168.2.4","216.58.203.132","TCP","54","58354  >  443 [ACK] Seq=121 Ack=2002 Win=258 Len=0"
"91","8.394421","192.168.2.4","216.58.203.132","TLSv1.2","100","Application Data"
"92","8.440126","216.58.203.132","192.168.2.4","TCP","60","443  >  58354 [ACK] Seq=2002 Ack=167 Win=176 Len=0"
"93","8.440724","192.168.2.4","172.217.26.227","TLSv1.2","321","Application Data"
"94","8.440831","192.168.2.4","172.217.26.227","TLSv1.2","100","Application Data"
"95","8.509445","172.217.26.227","192.168.2.4","TCP","60","443  >  58357 [ACK] Seq=1 Ack=268 Win=261 Len=0"
"96","8.509445","172.217.26.227","192.168.2.4","TCP","60","443  >  58357 [ACK] Seq=1 Ack=314 Win=261 Len=0"
"97","8.510533","172.217.26.227","192.168.2.4","TLSv1.2","100","Application Data"
"98","8.551545","192.168.2.4","172.217.26.227","TCP","54","58357  >  443 [ACK] Seq=314 Ack=47 Win=253 Len=0"
"99","8.583146","172.217.26.227","192.168.2.4","TLSv1.2","123","Application Data"
"100","8.583147","172.217.26.227","192.168.2.4","TLSv1.2","100","Application Data"
"101","8.583202","192.168.2.4","172.217.26.227","TCP","54","58357  >  443 [ACK] Seq=314 Ack=162 Win=258 Len=0"
"102","8.583842","192.168.2.4","172.217.26.227","TLSv1.2","100","Application Data"
"103","8.591067","192.168.2.4","216.58.203.132","TLSv1.2","180","Application Data"
"104","8.596177","216.58.203.132","192.168.2.4","TCP","60","443  >  58354 [ACK] Seq=2002 Ack=293 Win=176 Len=0"
"105","8.598569","216.58.203.132","192.168.2.4","TLSv1.2","245","Application Data"
"106","8.598570","216.58.203.132","192.168.2.4","TLSv1.2","1482","Application Data"
"107","8.598571","216.58.203.132","192.168.2.4","TLSv1.2","1482","Application Data"
"108","8.598571","216.58.203.132","192.168.2.4","TLSv1.2","1482","Application Data"
"109","8.598573","216.58.203.132","192.168.2.4","TLSv1.2","533","Application Data"
"110","8.598640","192.168.2.4","216.58.203.132","TCP","54","58354  >  443 [ACK] Seq=293 Ack=6956 Win=258 Len=0"
"111","8.598758","216.58.203.132","192.168.2.4","TLSv1.2","100","Application Data"
"112","8.598787","192.168.2.4","216.58.203.132","TCP","54","58354  >  443 [ACK] Seq=293 Ack=7002 Win=258 Len=0"
"113","8.598963","192.168.2.4","216.58.203.132","TLSv1.2","100","Application Data"
"114","8.608200","192.168.2.4","172.217.26.227","TLSv1.2","196","Application Data"
"115","8.620758","192.168.2.4","172.217.26.227","TLSv1.2","319","Application Data"
"116","8.644025","216.58.203.132","192.168.2.4","TCP","60","443  >  58354 [ACK] Seq=7002 Ack=339 Win=176 Len=0"
"117","8.676883","172.217.26.227","192.168.2.4","TCP","60","443  >  58357 [ACK] Seq=162 Ack=502 Win=269 Len=0"
"118","8.693761","192.168.2.4","172.217.26.227","TLSv1.2","245","Application Data"
"119","8.731700","172.217.26.227","192.168.2.4","TCP","60","443  >  58357 [ACK] Seq=162 Ack=767 Win=277 Len=0"
"120","8.762297","172.217.26.227","192.168.2.4","TCP","60","443  >  58357 [ACK] Seq=162 Ack=958 Win=286 Len=0"
"121","8.762745","172.217.26.227","192.168.2.4","TLSv1.2","100","Application Data"
"122","8.764581","172.217.26.227","192.168.2.4","TLSv1.2","100","Application Data"
"123","8.764632","192.168.2.4","172.217.26.227","TCP","54","58357  >  443 [ACK] Seq=958 Ack=254 Win=258 Len=0"
"124","8.764715","192.168.2.4","172.217.26.227","TLSv1.2","100","Application Data"
"125","8.805336","172.217.26.227","192.168.2.4","TLSv1.2","126","Application Data"
"126","8.805778","172.217.26.227","192.168.2.4","TLSv1.2","1482","Application Data"
"127","8.805779","172.217.26.227","192.168.2.4","TLSv1.2","1482","Application Data"
"128","8.805779","172.217.26.227","192.168.2.4","TLSv1.2","1482","Application Data"
"129","8.805821","192.168.2.4","172.217.26.227","TCP","54","58357  >  443 [ACK] Seq=1004 Ack=4610 Win=258 Len=0"
"130","8.811264","172.217.26.227","192.168.2.4","TLSv1.2","1482","Application Data"
"131","8.811265","172.217.26.227","192.168.2.4","TLSv1.2","1109","Application Data"
"132","8.811316","192.168.2.4","172.217.26.227","TCP","54","58357  >  443 [ACK] Seq=1004 Ack=7093 Win=258 Len=0"
"133","8.812107","172.217.26.227","192.168.2.4","TLSv1.2","1482","Application Data"
"134","8.812108","172.217.26.227","192.168.2.4","TLSv1.2","1482","Application Data"
"135","8.812109","172.217.26.227","192.168.2.4","TLSv1.2","1482","Application Data"
"136","8.812168","192.168.2.4","172.217.26.227","TCP","54","58357  >  443 [ACK] Seq=1004 Ack=11377 Win=258 Len=0"
"137","8.812822","172.217.26.227","192.168.2.4","TLSv1.2","1482","Application Data"
"138","8.812822","172.217.26.227","192.168.2.4","TLSv1.2","1482","Application Data"
"139","8.812823","172.217.26.227","192.168.2.4","TLSv1.2","1289","Application Data"
"140","8.812855","192.168.2.4","172.217.26.227","TCP","54","58357  >  443 [ACK] Seq=1004 Ack=15468 Win=258 Len=0"
"141","8.857273","172.217.26.227","192.168.2.4","TLSv1.2","106","Application Data"
"142","8.857274","172.217.26.227","192.168.2.4","TLSv1.2","597","Application Data"
"143","8.857274","172.217.26.227","192.168.2.4","TLSv1.2","92","Application Data"
"144","8.857360","192.168.2.4","172.217.26.227","TCP","54","58357  >  443 [ACK] Seq=1004 Ack=16101 Win=256 Len=0"
"145","8.857513","172.217.26.227","192.168.2.4","TLSv1.2","100","Application Data"
"146","8.857552","192.168.2.4","172.217.26.227","TCP","54","58357  >  443 [ACK] Seq=1004 Ack=16147 Win=256 Len=0"
"147","8.857869","192.168.2.4","172.217.26.227","TLSv1.2","100","Application Data"
"148","8.871414","172.217.26.227","192.168.2.4","TLSv1.2","1482","Application Data"
"149","8.871415","172.217.26.227","192.168.2.4","TLSv1.2","1482","Application Data"
"150","8.871416","172.217.26.227","192.168.2.4","TLSv1.2","1482","Application Data"
"151","8.871474","192.168.2.4","172.217.26.227","TCP","54","58357  >  443 [ACK] Seq=1050 Ack=20431 Win=258 Len=0"
"152","8.871588","172.217.26.227","192.168.2.4","TLSv1.2","1482","Application Data"
"153","8.871613","192.168.2.4","172.217.26.227","TCP","54","58357  >  443 [ACK] Seq=1050 Ack=21859 Win=258 Len=0"
"154","8.872359","172.217.26.227","192.168.2.4","TLSv1.2","1482","Application Data"
"155","8.872395","192.168.2.4","172.217.26.227","TCP","54","58357  >  443 [ACK] Seq=1050 Ack=23287 Win=258 Len=0"
"156","8.874327","172.217.26.227","192.168.2.4","TLSv1.2","1482","Application Data"
"157","8.874328","172.217.26.227","192.168.2.4","TLSv1.2","1482","Application Data"
"158","8.874374","192.168.2.4","172.217.26.227","TCP","54","58357  >  443 [ACK] Seq=1050 Ack=26143 Win=258 Len=0"
"159","8.879270","172.217.26.227","192.168.2.4","TLSv1.2","1482","Application Data"
"160","8.879271","172.217.26.227","192.168.2.4","TLSv1.2","1482","Application Data"
"161","8.879329","192.168.2.4","172.217.26.227","TLSv1.2","246","Application Data"
"162","8.879777","172.217.26.227","192.168.2.4","TLSv1.2","1482","Application Data"
"163","8.879778","172.217.26.227","192.168.2.4","TLSv1.2","1482","Application Data"
"164","8.879824","192.168.2.4","172.217.26.227","TCP","54","58357  >  443 [ACK] Seq=1242 Ack=31855 Win=258 Len=0"
"165","8.881213","172.217.26.227","192.168.2.4","TLSv1.2","1087","Application Data"
"166","8.881214","172.217.26.227","192.168.2.4","TLSv1.2","1482","Application Data"
"167","8.881266","192.168.2.4","172.217.26.227","TCP","54","58357  >  443 [ACK] Seq=1242 Ack=34316 Win=258 Len=0"
"168","8.882214","172.217.26.227","192.168.2.4","TLSv1.2","1482","Application Data"
"169","8.882258","192.168.2.4","172.217.26.227","TCP","54","58357  >  443 [ACK] Seq=1242 Ack=35744 Win=258 Len=0"
"170","8.884155","172.217.26.227","192.168.2.4","TLSv1.2","1482","Application Data"
"171","8.884156","172.217.26.227","192.168.2.4","TLSv1.2","1482","Application Data"
"172","8.884223","192.168.2.4","172.217.26.227","TCP","54","58357  >  443 [ACK] Seq=1242 Ack=38600 Win=258 Len=0"
"173","8.886512","172.217.26.227","192.168.2.4","TLSv1.2","1482","Application Data"
"174","8.886514","172.217.26.227","192.168.2.4","TLSv1.2","1289","Application Data"
"175","8.886575","192.168.2.4","172.217.26.227","TCP","54","58357  >  443 [ACK] Seq=1242 Ack=41263 Win=258 Len=0"
"176","8.887276","192.168.2.4","172.217.26.227","TLSv1.2","178","Application Data"
"177","8.894134","172.217.26.227","192.168.2.4","TLSv1.2","1482","Application Data"
"178","8.894136","172.217.26.227","192.168.2.4","TLSv1.2","1482","Application Data"
"179","8.894137","172.217.26.227","192.168.2.4","TLSv1.2","1482","Application Data"
"180","8.894249","192.168.2.4","172.217.26.227","TCP","54","58357  >  443 [ACK] Seq=1366 Ack=45547 Win=258 Len=0"
"181","8.896004","172.217.26.227","192.168.2.4","TLSv1.2","1482","Application Data"
"182","8.896005","172.217.26.227","192.168.2.4","TLSv1.2","1482","Application Data"
"183","8.896097","192.168.2.4","172.217.26.227","TCP","54","58357  >  443 [ACK] Seq=1366 Ack=48403 Win=258 Len=0"
"184","8.897593","172.217.26.227","192.168.2.4","TLSv1.2","1482","Application Data"
"185","8.897598","172.217.26.227","192.168.2.4","TLSv1.2","1482","Application Data"
"186","8.897747","192.168.2.4","172.217.26.227","TCP","54","58357  >  443 [ACK] Seq=1366 Ack=51259 Win=258 Len=0"
"187","8.902823","172.217.26.227","192.168.2.4","TLSv1.2","1482","Application Data"
"188","8.902823","172.217.26.227","192.168.2.4","TLSv1.2","1482","Application Data"
"189","8.902883","192.168.2.4","172.217.26.227","TCP","54","58357  >  443 [ACK] Seq=1366 Ack=54115 Win=258 Len=0"
"190","8.904865","172.217.26.227","192.168.2.4","TLSv1.2","1482","Application Data"
"191","8.904867","172.217.26.227","192.168.2.4","TLSv1.2","1482","Application Data"
"192","8.904867","172.217.26.227","192.168.2.4","TLSv1.2","1482","Application Data"
"193","8.904869","172.217.26.227","192.168.2.4","TLSv1.2","1482","Application Data [TCP segment of a reassembled PDU]"
"194","8.904926","192.168.2.4","172.217.26.227","TCP","54","58357  >  443 [ACK] Seq=1366 Ack=59827 Win=258 Len=0"
"195","8.906806","172.217.26.227","192.168.2.4","TLSv1.2","1482","Application Data [TCP segment of a reassembled PDU]"
"196","8.906807","172.217.26.227","192.168.2.4","TLSv1.2","750","Application Data"
"197","8.906856","192.168.2.4","172.217.26.227","TCP","54","58357  >  443 [ACK] Seq=1366 Ack=61951 Win=258 Len=0"
"198","8.928641","172.217.26.227","192.168.2.4","TLSv1.2","473","Application Data"
"199","8.928697","192.168.2.4","172.217.26.227","TCP","54","58357  >  443 [ACK] Seq=1366 Ack=62370 Win=257 Len=0"
"200","8.929379","172.217.26.227","192.168.2.4","TLSv1.2","92","Application Data"
"201","8.929381","172.217.26.227","192.168.2.4","TLSv1.2","100","Application Data"
"202","8.929502","192.168.2.4","172.217.26.227","TCP","54","58357  >  443 [ACK] Seq=1366 Ack=62454 Win=256 Len=0"
"203","8.929790","192.168.2.4","172.217.26.227","TLSv1.2","100","Application Data"
"204","8.956486","172.217.26.227","192.168.2.4","TCP","60","443  >  58357 [ACK] Seq=62454 Ack=1366 Win=294 Len=0"
"205","8.976133","192.168.2.4","172.217.26.227","TLSv1.2","300","Application Data"
"206","9.011416","192.168.2.4","172.217.26.227","TLSv1.2","96","Application Data"
"207","9.019393","192.168.2.4","172.217.26.227","TLSv1.2","247","Application Data"
"208","9.028959","172.217.26.227","192.168.2.4","TLSv1.2","100","Application Data"
"209","9.028960","172.217.26.227","192.168.2.4","TLSv1.2","100","Application Data"
"210","9.029113","192.168.2.4","172.217.26.227","TCP","54","58357  >  443 [ACK] Seq=1893 Ack=62546 Win=256 Len=0"
"211","9.029822","192.168.2.4","172.217.26.227","TLSv1.2","100","Application Data"
"212","9.049713","172.217.26.227","192.168.2.4","TLSv1.2","110","Application Data"
"213","9.049801","172.217.26.227","192.168.2.4","TLSv1.2","552","Application Data"
"214","9.049853","192.168.2.4","172.217.26.227","TCP","54","58357  >  443 [ACK] Seq=1939 Ack=63100 Win=254 Len=0"
"215","9.050040","172.217.26.227","192.168.2.4","TLSv1.2","92","Application Data"
"216","9.088672","172.217.26.227","192.168.2.4","TCP","60","443  >  58357 [ACK] Seq=63138 Ack=1893 Win=310 Len=0"
"217","9.091118","192.168.2.4","172.217.26.227","TCP","54","58357  >  443 [ACK] Seq=1939 Ack=63138 Win=254 Len=0"
"218","9.140132","172.217.26.227","192.168.2.4","TCP","60","443  >  58357 [ACK] Seq=63138 Ack=1939 Win=310 Len=0"
"219","9.150872","172.217.26.227","192.168.2.4","TLSv1.2","100","Application Data"
"220","9.151365","172.217.26.227","192.168.2.4","TLSv1.2","100","Application Data"
"221","9.151405","192.168.2.4","172.217.26.227","TCP","54","58357  >  443 [ACK] Seq=1939 Ack=63230 Win=253 Len=0"
"222","9.151489","192.168.2.4","172.217.26.227","TLSv1.2","100","Application Data"
"223","9.187439","172.217.26.227","192.168.2.4","TLSv1.2","110","Application Data"
"224","9.187440","172.217.26.227","192.168.2.4","TLSv1.2","572","Application Data"
"225","9.187440","172.217.26.227","192.168.2.4","TLSv1.2","92","Application Data"
"226","9.187497","192.168.2.4","172.217.26.227","TCP","54","58357  >  443 [ACK] Seq=1985 Ack=63842 Win=258 Len=0"
"227","9.220128","172.217.26.227","192.168.2.4","TCP","60","443  >  58357 [ACK] Seq=63842 Ack=1985 Win=310 Len=0"
"228","9.245155","192.168.2.4","216.58.203.174","TLSv1.2","327","Application Data"
"229","9.245293","192.168.2.4","216.58.203.174","TLSv1.2","100","Application Data"
"230","9.245352","192.168.2.4","216.58.203.174","TLSv1.2","195","Application Data"
"231","9.252491","216.58.203.174","192.168.2.4","TCP","60","443  >  58355 [ACK] Seq=1 Ack=274 Win=471 Len=0"
"232","9.252492","216.58.203.174","192.168.2.4","TCP","60","443  >  58355 [ACK] Seq=1 Ack=320 Win=471 Len=0"
"233","9.252492","216.58.203.174","192.168.2.4","TCP","60","443  >  58355 [ACK] Seq=1 Ack=461 Win=482 Len=0"
"234","9.252930","216.58.203.174","192.168.2.4","TLSv1.2","100","Application Data"
"235","9.294386","192.168.2.4","216.58.203.174","TCP","54","58355  >  443 [ACK] Seq=461 Ack=47 Win=257 Len=0"
"236","9.369619","192.168.2.4","216.58.203.131","TCP","66","58387  >  443 [SYN] Seq=0 Win=64240 Len=0 MSS=1460 WS=256 SACK_PERM=1"
"237","9.372872","192.168.2.4","216.58.203.132","TLSv1.2","202","Application Data"
"238","9.372989","192.168.2.4","216.58.203.132","TLSv1.2","100","Application Data"
"239","9.376199","216.58.203.131","192.168.2.4","TCP","66","443  >  58387 [SYN, ACK] Seq=0 Ack=1 Win=42780 Len=0 MSS=1380 SACK_PERM=1 WS=256"
"240","9.376333","192.168.2.4","216.58.203.131","TCP","54","58387  >  443 [ACK] Seq=1 Ack=1 Win=66048 Len=0"
"241","9.376530","192.168.2.4","216.58.203.131","TLSv1.2","259","Client Hello"
"242","9.378168","216.58.203.132","192.168.2.4","TCP","60","443  >  58349 [ACK] Seq=1 Ack=149 Win=203 Len=0"
"243","9.378169","216.58.203.132","192.168.2.4","TCP","60","443  >  58349 [ACK] Seq=1 Ack=195 Win=203 Len=0"
"244","9.379215","216.58.203.132","192.168.2.4","TLSv1.2","209","Application Data"
"245","9.379217","216.58.203.132","192.168.2.4","TLSv1.2","364","Application Data"
"246","9.379319","192.168.2.4","216.58.203.132","TCP","54","58349  >  443 [ACK] Seq=195 Ack=466 Win=256 Len=0"
"247","9.380198","216.58.203.132","192.168.2.4","TLSv1.2","100","Application Data"
"248","9.380199","216.58.203.132","192.168.2.4","TLSv1.2","100","Application Data"
"249","9.380251","192.168.2.4","216.58.203.132","TCP","54","58349  >  443 [ACK] Seq=195 Ack=558 Win=256 Len=0"
"250","9.380331","192.168.2.4","216.58.203.132","TLSv1.2","100","Application Data"
"251","9.384053","216.58.203.131","192.168.2.4","TCP","54","443  >  58387 [ACK] Seq=1 Ack=206 Win=44032 Len=0"
"252","9.386028","216.58.203.131","192.168.2.4","TLSv1.2","1482","Server Hello"
"253","9.386029","216.58.203.131","192.168.2.4","TCP","1482","443  >  58387 [ACK] Seq=1429 Ack=206 Win=44032 Len=1428 [TCP segment of a reassembled PDU]"
"254","9.386090","192.168.2.4","216.58.203.131","TCP","54","58387  >  443 [ACK] Seq=206 Ack=2857 Win=66048 Len=0"
"255","9.386335","192.168.2.4","172.217.26.227","TLSv1.2","244","Application Data"
"256","9.387035","216.58.203.131","192.168.2.4","TLSv1.2","1482","Certificate [TCP segment of a reassembled PDU]"
"257","9.387036","216.58.203.131","192.168.2.4","TLSv1.2","147","Server Key Exchange, Server Hello Done"
"258","9.387082","192.168.2.4","216.58.203.131","TCP","54","58387  >  443 [ACK] Seq=206 Ack=4378 Win=66048 Len=0"
"259","9.389217","192.168.2.4","216.58.203.131","TLSv1.2","312","Client Key Exchange, Change Cipher Spec, Encrypted Handshake Message, Encrypted Handshake Message"
"260","9.400092","216.58.203.131","192.168.2.4","TLSv1.2","375","New Session Ticket, Change Cipher Spec, Encrypted Handshake Message"
"261","9.400636","216.58.203.131","192.168.2.4","TLSv1.2","123","Application Data"
"262","9.400676","192.168.2.4","216.58.203.131","TCP","54","58387  >  443 [ACK] Seq=464 Ack=4768 Win=65792 Len=0"
"263","9.425262","216.58.203.132","192.168.2.4","TCP","60","443  >  58349 [ACK] Seq=558 Ack=241 Win=203 Len=0"
"264","9.454858","172.217.26.227","192.168.2.4","TCP","60","443  >  58357 [ACK] Seq=63842 Ack=2175 Win=319 Len=0"
"265","9.594789","172.217.26.227","192.168.2.4","TLSv1.2","514","Application Data"
"266","9.594790","172.217.26.227","192.168.2.4","TLSv1.2","1482","Application Data"
"267","9.594791","172.217.26.227","192.168.2.4","TLSv1.2","1482","Application Data"
"268","9.594793","172.217.26.227","192.168.2.4","TLSv1.2","1482","Application Data"
"269","9.594793","172.217.26.227","192.168.2.4","TLSv1.2","1482","Application Data"
"270","9.594794","172.217.26.227","192.168.2.4","TLSv1.2","1482","Application Data"
"271","9.594859","192.168.2.4","172.217.26.227","TCP","54","58357  >  443 [ACK] Seq=2175 Ack=71442 Win=258 Len=0"
"272","9.596694","172.217.26.227","192.168.2.4","TLSv1.2","1482","Application Data"
"273","9.596695","172.217.26.227","192.168.2.4","TLSv1.2","1482","Application Data"
"274","9.596742","192.168.2.4","172.217.26.227","TCP","54","58357  >  443 [ACK] Seq=2175 Ack=74298 Win=258 Len=0"
"275","9.597689","172.217.26.227","192.168.2.4","TLSv1.2","211","Application Data"
"276","9.637898","192.168.2.4","172.217.26.227","TCP","54","58357  >  443 [ACK] Seq=2175 Ack=74455 Win=258 Len=0"
"277","9.664333","172.217.26.227","192.168.2.4","TLSv1.2","1482","Application Data"
"278","9.664334","172.217.26.227","192.168.2.4","TLSv1.2","1482","Application Data"
"279","9.664335","172.217.26.227","192.168.2.4","TLSv1.2","1482","Application Data"
"280","9.664336","172.217.26.227","192.168.2.4","TLSv1.2","1482","Application Data"
"281","9.664337","172.217.26.227","192.168.2.4","TLSv1.2","1482","Application Data"
"282","9.664337","172.217.26.227","192.168.2.4","TLSv1.2","1482","Application Data"
"283","9.664338","172.217.26.227","192.168.2.4","TLSv1.2","1482","Application Data"
"284","9.664405","192.168.2.4","172.217.26.227","TCP","54","58357  >  443 [ACK] Seq=2175 Ack=84451 Win=258 Len=0"
"285","9.666208","172.217.26.227","192.168.2.4","TLSv1.2","1482","Application Data"
"286","9.666209","172.217.26.227","192.168.2.4","TLSv1.2","1482","Application Data"
"287","9.666258","192.168.2.4","172.217.26.227","TCP","54","58357  >  443 [ACK] Seq=2175 Ack=87307 Win=258 Len=0"
"288","9.667194","172.217.26.227","192.168.2.4","TLSv1.2","1482","Application Data"
"289","9.667195","172.217.26.227","192.168.2.4","TLSv1.2","1482","Application Data"
"290","9.667232","192.168.2.4","172.217.26.227","TCP","54","58357  >  443 [ACK] Seq=2175 Ack=90163 Win=258 Len=0"
"291","9.669151","172.217.26.227","192.168.2.4","TLSv1.2","187","Application Data"
"292","9.669196","192.168.2.4","172.217.26.227","TCP","54","58357  >  443 [ACK] Seq=2175 Ack=90296 Win=258 Len=0"
"293","9.676625","172.217.26.227","192.168.2.4","TLSv1.2","1482","Application Data"
"294","9.676626","172.217.26.227","192.168.2.4","TLSv1.2","1482","Application Data"
"295","9.676627","172.217.26.227","192.168.2.4","TLSv1.2","1482","Application Data"
"296","9.676681","192.168.2.4","172.217.26.227","TCP","54","58357  >  443 [ACK] Seq=2175 Ack=94580 Win=258 Len=0"
"297","9.677537","172.217.26.227","192.168.2.4","TLSv1.2","1482","Application Data"
"298","9.677538","172.217.26.227","192.168.2.4","TLSv1.2","1482","Application Data"
"299","9.677571","192.168.2.4","172.217.26.227","TCP","54","58357  >  443 [ACK] Seq=2175 Ack=97436 Win=258 Len=0"
"300","9.677984","172.217.26.227","192.168.2.4","TLSv1.2","1482","Application Data"
"301","9.678020","192.168.2.4","172.217.26.227","TCP","54","58357  >  443 [ACK] Seq=2175 Ack=98864 Win=258 Len=0"
"302","9.679334","172.217.26.227","192.168.2.4","TLSv1.2","1482","Application Data"
"303","9.679335","172.217.26.227","192.168.2.4","TLSv1.2","1482","Application Data"
"304","9.679382","192.168.2.4","172.217.26.227","TCP","54","58357  >  443 [ACK] Seq=2175 Ack=101720 Win=258 Len=0"
"305","9.680932","172.217.26.227","192.168.2.4","TLSv1.2","1482","Application Data"
"306","9.680933","172.217.26.227","192.168.2.4","TLSv1.2","1482","Application Data"
"307","9.680981","192.168.2.4","172.217.26.227","TCP","54","58357  >  443 [ACK] Seq=2175 Ack=104576 Win=258 Len=0"
"308","9.681890","172.217.26.227","192.168.2.4","TLSv1.2","1482","Application Data"
"309","9.681893","172.217.26.227","192.168.2.4","TLSv1.2","1081","Application Data"
"310","9.681933","192.168.2.4","172.217.26.227","TCP","54","58357  >  443 [ACK] Seq=2175 Ack=107031 Win=258 Len=0"
"311","9.712356","172.217.26.227","192.168.2.4","TLSv1.2","1482","Application Data"
"312","9.712357","172.217.26.227","192.168.2.4","TLSv1.2","1482","Application Data"
"313","9.712358","172.217.26.227","192.168.2.4","TLSv1.2","1482","Application Data"
"314","9.712360","172.217.26.227","192.168.2.4","TLSv1.2","1482","Application Data"
"315","9.712434","192.168.2.4","172.217.26.227","TCP","54","58357  >  443 [ACK] Seq=2175 Ack=112743 Win=258 Len=0"
"316","9.714299","172.217.26.227","192.168.2.4","TLSv1.2","1482","Application Data"
"317","9.714300","172.217.26.227","192.168.2.4","TLSv1.2","1482","Application Data"
"318","9.714348","192.168.2.4","172.217.26.227","TCP","54","58357  >  443 [ACK] Seq=2175 Ack=115599 Win=258 Len=0"
"319","9.715276","172.217.26.227","192.168.2.4","TLSv1.2","1482","Application Data"
"320","9.715278","172.217.26.227","192.168.2.4","TLSv1.2","1482","Application Data"
"321","9.715319","192.168.2.4","172.217.26.227","TCP","54","58357  >  443 [ACK] Seq=2175 Ack=118455 Win=258 Len=0"
"322","9.716575","172.217.26.227","192.168.2.4","TLSv1.2","1482","Application Data"
"323","9.716576","172.217.26.227","192.168.2.4","TLSv1.2","1482","Application Data"
"324","9.716577","172.217.26.227","192.168.2.4","TLSv1.2","1482","Application Data"
"325","9.716625","192.168.2.4","172.217.26.227","TCP","54","58357  >  443 [ACK] Seq=2175 Ack=122739 Win=258 Len=0"
"326","9.717038","172.217.26.227","192.168.2.4","TLSv1.2","1482","Application Data"
"327","9.717076","192.168.2.4","172.217.26.227","TCP","54","58357  >  443 [ACK] Seq=2175 Ack=124167 Win=258 Len=0"
"328","9.718477","172.217.26.227","192.168.2.4","TLSv1.2","430","Application Data"
"329","9.734312","172.217.26.227","192.168.2.4","TLSv1.2","250","Application Data"
"330","9.734360","192.168.2.4","172.217.26.227","TCP","54","58357  >  443 [ACK] Seq=2175 Ack=124739 Win=256 Len=0"
"331","9.736915","172.217.26.227","192.168.2.4","TLSv1.2","1482","Application Data"
"332","9.736916","172.217.26.227","192.168.2.4","TLSv1.2","1482","Application Data"
"333","9.736917","172.217.26.227","192.168.2.4","TLSv1.2","1482","Application Data"
"334","9.736918","172.217.26.227","192.168.2.4","TLSv1.2","1482","Application Data"
"335","9.736919","172.217.26.227","192.168.2.4","TLSv1.2","1079","Application Data, Application Data"
"336","9.736976","192.168.2.4","172.217.26.227","TCP","54","58357  >  443 [ACK] Seq=2175 Ack=131476 Win=258 Len=0"
"337","9.738691","172.217.26.227","192.168.2.4","TLSv1.2","100","Application Data"
"338","9.738740","192.168.2.4","172.217.26.227","TCP","54","58357  >  443 [ACK] Seq=2175 Ack=131522 Win=258 Len=0"
"339","9.738840","192.168.2.4","172.217.26.227","TLSv1.2","100","Application Data"
"340","9.773052","216.58.203.174","192.168.2.4","TLSv1.2","589","Application Data"
"341","9.773053","216.58.203.174","192.168.2.4","TLSv1.2","309","Application Data"
"342","9.773053","216.58.203.174","192.168.2.4","TLSv1.2","110","Application Data"
"343","9.773053","216.58.203.174","192.168.2.4","TLSv1.2","301","Application Data"
"344","9.773108","192.168.2.4","216.58.203.174","TCP","54","58355  >  443 [ACK] Seq=461 Ack=1140 Win=258 Len=0"
"345","9.773997","216.58.203.174","192.168.2.4","TLSv1.2","100","Application Data"
"346","9.774935","192.168.2.4","216.58.203.174","TLSv1.2","100","Application Data"
"347","9.807503","172.217.26.227","192.168.2.4","TCP","60","443  >  58357 [ACK] Seq=131522 Ack=2221 Win=319 Len=0"
"348","9.819986","216.58.203.174","192.168.2.4","TCP","60","443  >  58355 [ACK] Seq=1186 Ack=507 Win=482 Len=0"
"349","9.913183","192.168.2.4","216.58.203.174","TLSv1.2","181","Application Data"
"350","9.913272","192.168.2.4","216.58.203.174","TLSv1.2","100","Application Data"
"351","9.913313","192.168.2.4","216.58.203.174","TCP","1434","58348  >  443 [ACK] Seq=174 Ack=1 Win=258 Len=1380 [TCP segment of a reassembled PDU]"
"352","9.913321","192.168.2.4","216.58.203.174","TLSv1.2","114","Application Data"
"353","9.918301","216.58.203.174","192.168.2.4","TCP","60","443  >  58348 [ACK] Seq=1 Ack=128 Win=272 Len=0"
"354","9.918301","216.58.203.174","192.168.2.4","TCP","60","443  >  58348 [ACK] Seq=1 Ack=174 Win=272 Len=0"
"355","9.919054","216.58.203.174","192.168.2.4","TLSv1.2","100","Application Data"
"356","9.919310","216.58.203.174","192.168.2.4","TCP","60","443  >  58348 [ACK] Seq=47 Ack=1614 Win=283 Len=0"
"357","9.965443","192.168.2.4","216.58.203.174","TCP","54","58348  >  443 [ACK] Seq=1614 Ack=47 Win=258 Len=0"
"358","10.073192","216.58.203.174","192.168.2.4","TLSv1.2","141","Application Data"
"359","10.073192","216.58.203.174","192.168.2.4","TLSv1.2","803","Application Data"
"360","10.073244","192.168.2.4","216.58.203.174","TCP","54","58348  >  443 [ACK] Seq=1614 Ack=883 Win=255 Len=0"
"361","10.073567","216.58.203.174","192.168.2.4","TLSv1.2","210","Application Data"
"362","10.073568","216.58.203.174","192.168.2.4","TLSv1.2","281","Application Data"
"363","10.073568","216.58.203.174","192.168.2.4","TLSv1.2","100","Application Data"
"364","10.073602","192.168.2.4","216.58.203.174","TCP","54","58348  >  443 [ACK] Seq=1614 Ack=1312 Win=253 Len=0"
"365","10.073930","192.168.2.4","216.58.203.174","TLSv1.2","100","Application Data"
"366","10.075193","192.168.2.4","216.58.203.174","TLSv1.2","181","Application Data"
"367","10.075442","192.168.2.4","216.58.203.174","TLSv1.2","1374","Application Data"
"368","10.082699","216.58.203.174","192.168.2.4","TCP","60","443  >  58348 [ACK] Seq=1312 Ack=1787 Win=283 Len=0"
"369","10.104295","50.16.201.220","192.168.2.4","TLSv1.2","85","Encrypted Alert"
"370","10.104296","50.16.201.220","192.168.2.4","TCP","54","443  >  58350 [FIN, ACK] Seq=32 Ack=1 Win=123 Len=0"
"371","10.104352","192.168.2.4","50.16.201.220","TCP","54","58350  >  443 [ACK] Seq=1 Ack=33 Win=254 Len=0"
"372","10.121044","216.58.203.174","192.168.2.4","TCP","60","443  >  58348 [ACK] Seq=1312 Ack=3107 Win=294 Len=0"
"373","10.220436","216.58.203.174","192.168.2.4","TLSv1.2","117","Application Data"
"374","10.220436","216.58.203.174","192.168.2.4","TLSv1.2","693","Application Data"
"375","10.220512","192.168.2.4","216.58.203.174","TCP","54","58348  >  443 [ACK] Seq=3107 Ack=2014 Win=258 Len=0"
"376","10.221422","216.58.203.174","192.168.2.4","TLSv1.2","222","Application Data"
"377","10.221423","216.58.203.174","192.168.2.4","TLSv1.2","102","Application Data"
"378","10.221423","216.58.203.174","192.168.2.4","TLSv1.2","100","Application Data"
"379","10.221471","192.168.2.4","216.58.203.174","TCP","54","58348  >  443 [ACK] Seq=3107 Ack=2276 Win=257 Len=0"
"380","10.222151","192.168.2.4","216.58.203.174","TLSv1.2","100","Application Data"
"381","10.227303","216.58.203.174","192.168.2.4","TCP","60","443  >  58348 [ACK] Seq=2276 Ack=3153 Win=294 Len=0"
"382","10.424945","192.168.2.4","216.58.203.174","TLSv1.2","181","Application Data"
"383","10.425039","192.168.2.4","216.58.203.174","TLSv1.2","1061","Application Data"
"384","10.430639","216.58.203.174","192.168.2.4","TCP","60","443  >  58348 [ACK] Seq=2276 Ack=3280 Win=294 Len=0"
"385","10.431589","216.58.203.174","192.168.2.4","TCP","60","443  >  58348 [ACK] Seq=2276 Ack=4287 Win=305 Len=0"
"386","10.524252","192.168.2.4","216.58.203.174","TLSv1.2","405","Application Data"
"387","10.524374","192.168.2.4","216.58.203.174","TLSv1.2","195","Application Data"
"388","10.530178","216.58.203.174","192.168.2.4","TCP","60","443  >  58355 [ACK] Seq=1186 Ack=858 Win=493 Len=0"
"389","10.530179","216.58.203.174","192.168.2.4","TCP","60","443  >  58355 [ACK] Seq=1186 Ack=999 Win=503 Len=0"
"390","10.575170","216.58.203.174","192.168.2.4","TLSv1.2","117","Application Data"
"391","10.575170","216.58.203.174","192.168.2.4","TLSv1.2","674","Application Data"
"392","10.575220","192.168.2.4","216.58.203.174","TCP","54","58348  >  443 [ACK] Seq=4287 Ack=2959 Win=255 Len=0"
"393","10.575629","216.58.203.174","192.168.2.4","TLSv1.2","184","Application Data"
"394","10.575629","216.58.203.174","192.168.2.4","TLSv1.2","123","Application Data"
"395","10.575630","216.58.203.174","192.168.2.4","TLSv1.2","100","Application Data"
"396","10.575670","192.168.2.4","216.58.203.174","TCP","54","58348  >  443 [ACK] Seq=4287 Ack=3204 Win=254 Len=0"
"397","10.575944","192.168.2.4","216.58.203.174","TLSv1.2","100","Application Data"
"398","10.587329","216.58.203.174","192.168.2.4","TCP","60","443  >  58348 [ACK] Seq=3204 Ack=4333 Win=305 Len=0"
"399","10.695588","192.168.2.4","172.217.26.227","TLSv1.2","607","Application Data"
"400","10.730761","192.168.2.4","172.217.26.227","TLSv1.2","208","Application Data"
"401","10.753435","192.168.2.4","172.217.26.227","TLSv1.2","149","Application Data"
"402","10.765635","172.217.26.227","192.168.2.4","TCP","60","443  >  58357 [ACK] Seq=131522 Ack=2774 Win=327 Len=0"
"403","10.789431","192.168.2.4","8.8.8.8","DNS","78","Standard query 0x5547 A www.googleapis.com"
"404","10.799324","172.217.26.227","192.168.2.4","TCP","60","443  >  58357 [ACK] Seq=131522 Ack=2928 Win=335 Len=0"
"405","10.823692","172.217.26.227","192.168.2.4","TCP","60","443  >  58357 [ACK] Seq=131522 Ack=3023 Win=335 Len=0"
"406","10.848386","172.217.26.227","192.168.2.4","TLSv1.2","123","Application Data"
"407","10.848387","172.217.26.227","192.168.2.4","TLSv1.2","100","Application Data"
"408","10.848443","192.168.2.4","172.217.26.227","TCP","54","58357  >  443 [ACK] Seq=3023 Ack=131637 Win=258 Len=0"
"409","10.849241","192.168.2.4","172.217.26.227","TLSv1.2","100","Application Data"
"410","10.873116","8.8.8.8","192.168.2.4","DNS","208","Standard query response 0x5547 A www.googleapis.com CNAME googleapis.l.google.com A 172.217.27.202 A 216.58.199.170 A 172.217.26.234 A 216.58.196.74 A 216.58.199.138 A 216.58.203.202"
"411","10.873650","192.168.2.4","172.217.27.202","TCP","66","58388  >  443 [SYN] Seq=0 Win=64240 Len=0 MSS=1460 WS=256 SACK_PERM=1"
"412","10.880374","172.217.27.202","192.168.2.4","TCP","66","443  >  58388 [SYN, ACK] Seq=0 Ack=1 Win=42780 Len=0 MSS=1380 SACK_PERM=1 WS=256"
"413","10.880528","192.168.2.4","172.217.27.202","TCP","54","58388  >  443 [ACK] Seq=1 Ack=1 Win=66048 Len=0"
"414","10.880705","192.168.2.4","172.217.27.202","TLSv1.2","256","Client Hello"
"415","10.888373","172.217.27.202","192.168.2.4","TCP","54","443  >  58388 [ACK] Seq=1 Ack=203 Win=44032 Len=0"
"416","10.890129","172.217.27.202","192.168.2.4","TLSv1.2","1482","Server Hello"
"417","10.890733","172.217.27.202","192.168.2.4","TCP","1482","443  >  58388 [ACK] Seq=1429 Ack=203 Win=44032 Len=1428 [TCP segment of a reassembled PDU]"
"418","10.890762","192.168.2.4","172.217.27.202","TCP","54","58388  >  443 [ACK] Seq=203 Ack=2857 Win=66048 Len=0"
"419","10.892076","172.217.27.202","192.168.2.4","TLSv1.2","695","Certificate, Server Key Exchange, Server Hello Done"
"420","10.893208","192.168.2.4","172.217.27.202","TLSv1.2","147","Client Key Exchange, Change Cipher Spec, Encrypted Handshake Message"
"421","10.895985","172.217.26.227","192.168.2.4","TLSv1.2","109","Application Data"
"422","10.895985","172.217.26.227","192.168.2.4","TLSv1.2","315","Application Data"
"423","10.895986","172.217.26.227","192.168.2.4","TLSv1.2","92","Application Data"
"424","10.896045","192.168.2.4","172.217.26.227","TCP","54","58357  >  443 [ACK] Seq=3069 Ack=131991 Win=256 Len=0"
"425","10.901725","172.217.27.202","192.168.2.4","TLSv1.2","338","New Session Ticket, Change Cipher Spec, Encrypted Handshake Message"
"426","10.901726","172.217.27.202","192.168.2.4","TLSv1.2","123","Application Data"
"427","10.901774","192.168.2.4","172.217.27.202","TCP","54","58388  >  443 [ACK] Seq=296 Ack=3851 Win=65024 Len=0"
"428","10.901985","192.168.2.4","172.217.27.202","TLSv1.2","147","Application Data"
"429","10.902207","192.168.2.4","172.217.27.202","TLSv1.2","92","Application Data"
"430","10.902302","192.168.2.4","172.217.27.202","TLSv1.2","319","Application Data"
"431","10.902356","192.168.2.4","172.217.27.202","TLSv1.2","434","Application Data"
"432","10.903391","172.217.26.227","192.168.2.4","TLSv1.2","105","Application Data"
"433","10.903433","192.168.2.4","172.217.26.227","TCP","54","58357  >  443 [ACK] Seq=3069 Ack=132042 Win=256 Len=0"
"434","10.903833","172.217.26.227","192.168.2.4","TLSv1.2","1191","Application Data"
"435","10.903834","172.217.26.227","192.168.2.4","TLSv1.2","92","Application Data"
"436","10.903867","192.168.2.4","172.217.26.227","TCP","54","58357  >  443 [ACK] Seq=3069 Ack=133217 Win=258 Len=0"
"437","10.909967","172.217.27.202","192.168.2.4","TCP","54","443  >  58388 [ACK] Seq=3851 Ack=427 Win=44032 Len=0"
"438","10.910459","172.217.27.202","192.168.2.4","TCP","60","[TCP Previous segment not captured] 443  >  58388 [ACK] Seq=3889 Ack=1072 Win=46080 Len=0"
"439","10.910460","172.217.27.202","192.168.2.4","TCP","92","[TCP Retransmission] 443  >  58388 [PSH, ACK] Seq=3851 Ack=427 Win=44032 Len=38"
"440","10.949768","192.168.2.4","172.217.27.202","TCP","54","58388  >  443 [ACK] Seq=1072 Ack=3889 Win=65024 Len=0"
"441","10.966168","172.217.26.227","192.168.2.4","TCP","60","443  >  58357 [ACK] Seq=133217 Ack=3069 Win=335 Len=0"
"442","10.990754","172.217.27.202","192.168.2.4","TLSv1.2","412","Application Data"
"443","10.990756","172.217.27.202","192.168.2.4","TLSv1.2","620","Application Data, Application Data"
"444","10.990757","172.217.27.202","192.168.2.4","TLSv1.2","100","Application Data"
"445","10.990907","192.168.2.4","172.217.27.202","TCP","54","58388  >  443 [ACK] Seq=1072 Ack=4859 Win=66048 Len=0"
"446","10.992306","192.168.2.4","172.217.27.202","TLSv1.2","100","Application Data"
"447","11.009066","192.168.2.4","172.217.26.227","TLSv1.2","346","Application Data"
"448","11.037533","172.217.27.202","192.168.2.4","TCP","60","443  >  58388 [ACK] Seq=4859 Ack=1118 Win=46080 Len=0"
"449","11.089998","216.58.203.174","192.168.2.4","TLSv1.2","590","Application Data"
"450","11.090000","216.58.203.174","192.168.2.4","TLSv1.2","152","Application Data"
"451","11.090002","216.58.203.174","192.168.2.4","TLSv1.2","107","Application Data"
"452","11.090003","216.58.203.174","192.168.2.4","TLSv1.2","118","Application Data"
"453","11.090176","192.168.2.4","216.58.203.174","TCP","54","58355  >  443 [ACK] Seq=999 Ack=1937 Win=255 Len=0"
"454","11.090462","216.58.203.174","192.168.2.4","TLSv1.2","100","Application Data"
"455","11.092381","192.168.2.4","216.58.203.174","TLSv1.2","100","Application Data"
"456","11.098845","216.58.203.174","192.168.2.4","TCP","60","443  >  58355 [ACK] Seq=1983 Ack=1045 Win=503 Len=0"
"457","11.128486","172.217.26.227","192.168.2.4","TCP","60","443  >  58357 [ACK] Seq=133217 Ack=3361 Win=343 Len=0"
"458","11.149556","172.217.26.227","192.168.2.4","TLSv1.2","100","Application Data"
"459","11.149557","172.217.26.227","192.168.2.4","TLSv1.2","100","Application Data"
"460","11.149622","192.168.2.4","172.217.26.227","TCP","54","58357  >  443 [ACK] Seq=3361 Ack=133309 Win=258 Len=0"
"461","11.150903","192.168.2.4","172.217.26.227","TLSv1.2","100","Application Data"
"462","11.219741","172.217.26.227","192.168.2.4","TCP","60","443  >  58357 [ACK] Seq=133309 Ack=3407 Win=343 Len=0"
"463","11.494583","192.168.2.4","216.58.203.174","TLSv1.2","1340","Application Data"
"464","11.494711","192.168.2.4","216.58.203.174","TLSv1.2","410","Application Data"
"465","11.500500","216.58.203.174","192.168.2.4","TCP","60","443  >  58355 [ACK] Seq=1983 Ack=2331 Win=514 Len=0"
"466","11.500500","216.58.203.174","192.168.2.4","TCP","60","443  >  58355 [ACK] Seq=1983 Ack=2687 Win=525 Len=0"
"467","11.945217","216.58.203.174","192.168.2.4","TLSv1.2","314","Application Data"
"468","11.945218","216.58.203.174","192.168.2.4","TLSv1.2","100","Application Data"
"469","11.945274","192.168.2.4","216.58.203.174","TCP","54","58355  >  443 [ACK] Seq=2687 Ack=2289 Win=254 Len=0"
"470","11.945731","192.168.2.4","216.58.203.174","TLSv1.2","100","Application Data"
"471","11.951237","216.58.203.174","192.168.2.4","TCP","60","443  >  58355 [ACK] Seq=2289 Ack=2733 Win=525 Len=0"
